legacy_gestore_id,testo,data
2233,....in preparazione per la stagione autunno-inverno ^_^,09/21/10 09:21:33
2882,Giorno 23 Ottobre LIVE at RITMIA CLUB di Pianengo (CR),09/24/10 12:20:03
3378,"Il grande evento è alle porte,  Housebreakers 15th Anniversary, sta sera ore 22.00 al Taurus - Ciriè (To)",09/25/10 12:29:02
3265,Ci stiamo preparando per :::::::SABATO 2 OTTOBRE:::::Novità!!!::::: AUT AUT ::::: Locale STUPENDO!,09/28/10 21:15:35
3420,...in fase di pre-produzione...,09/30/10 22:07:58
3421,prove,10/02/10 01:07:35
3421,rehearsal,10/03/10 01:06:18
3422,RoMa,10/03/10 04:55:36
3378,"Un ringraziamento enorme a tutti i partecipanti per aver reso incredibile la serata del 15 anniversario, siete stati fantastici, Grazie!!",10/04/10 10:02:18
3427,"Riposo dopo le fatiche dell'ultimo album, ""L'ineluttabile paradosso di Cassiopea""",10/09/10 19:22:31
3255,Suoneremo allo Zenigata di Firenze per il Musikal-Contest 2010,10/10/10 14:13:25
3428,"Si studiano pezzi nuovi, si crea musica!!!",10/11/10 16:57:05
3430,"ricerca date per presentazione nuovo album ""I' M A PUNKROCKER""",10/11/10 20:02:35
3432,Stiamo lavorando al 4° inedito!,10/15/10 02:05:30
3323,http://www.myspace.com/smitetheshepherdgang   DAI CAZZO!!,10/17/10 11:59:08
3432,Sempre al lavoro!!!,10/17/10 17:32:51
2883,A BREVE DATE LIVE!!!,10/17/10 22:13:02
3432,4° inedito quasi terminato!,10/20/10 15:14:37
3228,ABBIAMO UN REGALO PER TE!! VAI SU http://fourback.believeband.com,10/22/10 16:15:54
3421,ripasso brani per  il prossimo spettacolo...,10/24/10 02:41:39
3422,in studio per l'album!,10/24/10 11:33:45
3434,Cerchiamo date in Veneto!!!,10/25/10 02:41:15
2858,IL 13 Novembre 2010 LIVE CONCERT E55  Presso TEX SALOON Via Biblioteca Avallone 93-95 CAVA DE' TIRRENI (SA),10/25/10 08:37:39
2858,26 Novembre NOTTE RADIO ENTROPIA www.radioentropia.it LIVE E55 con intermezzo si presentazione di due videoclip degli E55 serata prenotabil  (zona Cardito (NA)),10/25/10 08:45:13
2233,in fase CONCERTI.....29/10/2010@ Siddharta Alternative Club (PO).........30/10/2010@ Ottavo nano Pub (LU) !!!,10/26/10 11:03:09
3326,Organizza nuovi concerti,10/28/10 12:52:03
1797,Stampa il cd e poi...rivoluzioneee,11/01/10 10:48:33
3331,Tra poco inizierà la pre-produzione del primo cd dei Feelback (dopo la demo),11/02/10 18:59:46
3323,Sabato 27 Novembre apriamo agli EVERGREEN TERRACE + CASEY JONES + FUCKED UP  http://www.myspace.com/smitetheshepherdgang,11/03/10 18:50:20
3436,Nuove date in arrivo!,11/05/10 00:53:00
3385,A lavoro per preparare il nuovo live previsto per l'11 dicembre,11/05/10 13:50:37
3432,4à inedito online!,11/07/10 22:34:03
3439,Pubbicato su itunes (http://itunes.apple.com/it/album/rock-wall/id400461871?i=400461877) il primo singolo Rock Wall contiene anche la versione in italiano!!!,11/09/10 17:21:05
3378,New Album Upcoming,11/11/10 14:36:17
3428,Apportando le modifiche ai nostri pezzi!!,11/14/10 09:57:37
3334,"PRESENTAZIONE EP SILENZIO SOSPETTO - SPECIAL GUEST ""IL DUBBIO DI DAVIDE"" - Venerdì 3 Dicembre 2010 h 20.00 @ CAFFE' DEL PROGRESSO - TORINO!!! VI ASPETTIAMO!!!",11/15/10 12:41:27
3441,aspetta l'imminente uscita del nuovo album,11/15/10 18:11:14
3439,Sta arrivando il cd ROCK WALL e ci sarà pure la presentazione all'inferno disco bar con un mio live solista!!!! da non perdere assolutamente!!!!!!!!!!!!!!!!,11/18/10 23:49:42
3441,guarda il backstage del suo videoclip: http://www.youtube.com/watch?v=jjZ1i4rruqQ,11/20/10 10:30:43
1572,Sono cambiati tre elementi. Stiamo riarrangiando il repertorio.,11/21/10 10:30:30
3396,miniWinterCristalTour is coming (;,11/21/10 12:17:57
3255,a Dicembre live al Rock' n roll di Milano!!!!,11/21/10 13:26:26
2858,visita il nostro sito www.e55.it,11/24/10 16:22:24
2858,visita il nostro sito: www.e55.it,11/28/10 09:49:50
2923,"a breve uscirà il nostro primo album!!!!! DECABOX "" L'uomo biodegradabile""",11/28/10 13:24:54
3315,"Concerto Sabato 18 Dicembre 2010 a ""Lo Sciamano"" Via Mompiani,2 Roma",11/28/10 15:49:05
3408,Freedom is inside your heart...,11/29/10 16:45:58
3421,arrangiamento del nuovo brano tradizionale ;-),12/05/10 01:08:01
3441,si preprarano per la semifinale del Veneto Rock contest,12/05/10 11:03:46
2858,per acquistare il nostro CD contattaci al seguente indirizzo e552009@libero.it e ascoltai nostri brani  nel nostro sito www.e55.it,12/05/10 23:07:24
1929,"""we are looking for a new label, contact us!!""",12/07/10 12:07:50
3436,"Ci prepariamo per un live acustico alla Public House di Firenze, con Jolly Rox e Junkie Dildoz! Non mancate! - 09/12/2010 ore 22:30",12/08/10 12:26:21
3442,"9/12/2010 - RH Live @ Cacao Bar, Crespano del Grappa, Via Roma 7, h 22:50!!",12/09/10 16:37:48
3439,LUKE J. BURTON si prepara per il concerto di presentazione del singolo Rock Wall!!! Sabato 18 dicembre all'Inferno Disco Bar!!!!,12/11/10 20:55:43
2858,per acquistare il nostro CD contattaci al seguente indirizzo e552009@libero.it e ascoltai nostri brani nel nostro sito www.e55.it,12/12/10 10:49:47
2940,Preparazione concerto fine anno...,12/12/10 19:15:58
3446,Crea la 5° canzone e si prepara per il contest di domenica 19 dicembre 2010,12/14/10 03:07:16
3441,guarda il suo primo VIDEOCLIP ... che la Maieutica fluisca,12/14/10 10:43:09
389,Cr,12/14/10 16:08:35
2787,Suona!!!!!!!!!!!!!!!!!!!!!!!!!!!!,12/14/10 23:52:32
3447,...only when she decided to die...,12/15/10 18:31:24
2858,"2 GENNAIO 2011 LIVE EVENT AT MARIGLIANO (NA) ""BENTLEYS PUB"" P.zza Castello, 22B",12/19/10 10:34:41
3255,il 23 Gennaio Live al Rock'n Roll di  Milano!!!!,12/24/10 16:09:09
3452,Attività live in vari contest presso localie centri sociali. Nella prossima primavera entreremo in studio per l'incisione del nostro primo cd.,12/26/10 18:25:21
1647,"The album  ""From Ashes To Madness"" is out!!!",12/30/10 13:22:59
3399,I mabilia stanno preparando nuovo materiale da aggiungere a quello finora realizzato,01/01/11 21:57:51
2858,"23 gennaio 2011 E55 LIVE In Marigliano (NA) Evento special con RADIO ENTROPIA (www.radioentropia.it) c/o ""Loggia dei Pirati""",01/02/11 09:32:14
3454,iscrizioni aperte fino il 28 febbraio  www.unimelody.it,01/02/11 17:15:50
3315,"13 Gennaio2011 Serata we are the festivalal Felt Via degli Ausoni,84 00185 Roma",01/02/11 23:09:04
3334,"SILENZIO SOSPETTO + GLATUS Live @ DIVINA COMMEDIA - Via San Donato, 47 TORINO ore 22.00 - VI ASPETTIAMO PER IL PRIMO LIVE DEL 2011!!!",01/03/11 00:37:01
2858,"23 gennaio 2011 E55 LIVE In Marigliano (NA) Evento special con RADIO ENTROPIA (www.radioentropia.it) c/o ""Loggia dei Pirati""",01/03/11 14:30:11
3454,Vi ricordiamo che le iscrizioni al concorso UNimelody sono effettuabili sono attraverso il sito WWW.UNIMELODY.IT,01/03/11 16:16:50
3457,Ci stiamo preparando per un Live ad aprile 2011,01/06/11 16:00:48
3457,Seguiteci sulla nostra pagina ufficiale!! http://www.facebook.com/#!/pages/Iks-solo-musica-seria/137533316304171,01/06/11 16:10:03
3460,"Promuove il nuovo disco ""PRIMO""",01/08/11 03:20:27
3224,Meduse su RAI 5 Mercoledì 12 gennaio alle 19:00!!!,01/09/11 13:49:27
3460,"14 gennaio live@ISOLA BLU - Giovanni Leone 1, San Felice a Cancello",01/09/11 14:11:05
3224,è saltata la serata di RHo alive :(,01/12/11 13:07:08
3224,STASERA le MEDUSE saranno su RAI 5 dalle 19:30!!!,01/12/11 13:07:34
3442,"23/01/2011 - RH Live @ Creazzo VI, Polispostivo comunale, h 15:00!",01/13/11 21:03:58
3992,ola!!!,05/23/17 13:05:28
3992,Stasera Pantone?,05/23/17 17:50:13
4078,"codice completamente ottimizzato, il delivery della nuova versione di myband è ormai vicino!",05/23/17 19:48:59
3992,"ho trovato la soluzione della mancata visualizzazione della TEXTBOX per scrivere sulle bacheche, anche se non ho capito come ho fatto, adesso funziona e va bene così!!!",05/31/17 09:13:15
82,test!,06/01/17 13:10:00
4013,"ciao Ivan, benvenuto su MY-BAND.IT",06/04/17 19:38:46
3992,"quando hai un momento, mi scrivi un messaggio sulla mia bacheca?",06/08/17 12:26:19
4078,Ho risolto il problema di visualizzazione della TIMELINE con il dominio settato in Full Trust. L'esperienza insegna!,06/08/17 12:34:05
82,Test!!,06/08/17 13:38:15
3075,"Ciao Fabio, abbiamo seguito con interesse la tua carriera artistica e siamo felizissimi che in passato hai utilizzato anche MY-BAND.IT per farti conoscere. Ci piacerebbe intervistarti per il nostro BLOG che trovi all'indirizzo http://blog.my-band.it - in attesa di un tuo riscontro, cordiali saluti. Lo staff di MY-BAND.IT",06/09/17 17:31:41
3992,Fosse che fosse la volta buona?,06/12/17 08:52:15
4078,a breve partir&#224; il PODCAST di MyBand!,02/02/19 17:36:24
111,"Ciao ragazzi, ben ritrovati su MyBand... di tempo ne &#232; passato vero???",02/21/19 20:24:27
4131,https://youtu.be/E0yDC1JFa-4,03/06/19 14:38:35
2733,Il podcast di myband e ormai una realt&#224; consolidata. Sono sempre di pi&#249; gli artisti intervistati da Gianluca Di Pietro e sempre pi&#249; numerosi sono gli addetti ai lavori che fanno di myband la propria piattaforma di lancio delle notizie relative alla musica indipendente.,04/02/19 09:05:12
2131,ciao a tutti!,04/06/19 23:27:11
2733,"Gli sviluppatori di MyBand stanno lavorando all&#39;ottimizzazione SEO delle pagine del Blog. Google ha indicizzato oltre 3000 contenuti e molti altri oggetti torneranno visibili nei motori di ricerca. MyBand, con la propria presenza in rete dal 2003, si attesta come uno dei portali di riferimento della musica indipendente italiana pi&#249; importante di sempre.",04/11/19 16:22:11
3527,"Abbiamo registrato due cd &quot;Psicofolkhardrock&quot; e &quot;Rebirth2-The Turning Point&quot;;quest&#180;ultimo con addirittura 14 brani e una bonus track,mentre &quot;Psicofolkhardrock&quot; contiene altri 4 brani ed e&#180; considerato il demo della band. La stampa del cd Rebirth2 e&#180; stata sospesa per divergenze sul progetto e la sua distribuzione e al momento tutte le copie sono state ritirate al suo legittimo proprietario dei diritti di autore &quot;Cristiano Angelo&quot; che per cause personali ha dovuto rinunciare alla stampa del cd. Adriano Coppede il bassista&#180; dopo tanti anni lascia la band che al momento si dichiara sciolta in attesa che ci sia degli sviluppi sia lavorativi personali che musicali del leader Cristiano Angelo. Andrea Cecchi rimane ufficialmente all&#180;attivo in attesa di un eventuale ritorno in Italia di Angelo.",04/22/19 16:00:32
2733,"Da domani online i bandi per i concorsi<br /><br />Europa e Mediterraneo, SchermoNapoli e Videoclip Sessions<br /><br />Scadenza 30 giugno 2019<br /><br /><br />Napoli, 29 aprile – Saranno online da domani i bandi di concorso della 21esima edizione del Napoli Film Festival (modalit&#224; di partecipazione sul sito www.napolifilmfestival.com, sulla pagina Facebook del Festival e www.filmfreeway.com, scadenza 30 giugno 2019), la rassegna cinematografica diretta da Mario Violini, che si svolger&#224; dal 23 al 30 settembre 2019 in vari luoghi della citt&#224;, organizzata dall’Associazione “NapoliCinema”. La manifestazione conferma l’impegno a garantire la massima visibilit&#224; alle opere proposte, anche dopo l’evento: l’obiettivo &#232; far scoprire al pubblico quei film spesso penalizzati dalla distribuzione italiana.<br /><br />Cuore del festival il concorso Europa e Mediterraneo, la competizione internazionale riservata a film d’autore delle cinematografie europee e del Mediterraneo che difficilmente sarebbe possibile trovare nei circuiti distributivi commerciali. Al vincitore andr&#224; il Vesuvio Award, una scultura di bronzo realizzata da Lello Esposito e il Premio Augustus Color, 10 copie in formato DCP, supporto digitale per la proiezione nei cinema, allo scopo di favorirne l&#39;acquisizione da parte della distribuzione italiana. <br /><br />Ai vincitori del concorso SchermoNapoli, la vetrina dedicata ai giovani registi campani o ai lavori che hanno per oggetto la Campania, diviso nelle sezioni Doc, Corti e Scuola, andr&#224; il Vesuvio Award e inoltre avranno l’occasione di farsi conoscere all’estero in rassegne organizzate dall&#39;Associazione NapoliCinema come 41&#176; Parallelo presso la Casa Italiana Zerillo-Marimo New York University Department of Italian Studies. <br /><br />Infine Diregiovani in collaborazione con l&#39;Agenzia di stampa Dire assegner&#224; il Premio Giovani Visioni all&#39;opera che si &#232; distinta per un&#39;idea originale che coniughi informazione, linguaggio narrativo ed efficacia del messaggio trasmesso. A uno dei vincitori dei concorsi andr&#224; anche il Premio Avanti!, che garantisce la distribuzione nel circuito cinematografico a cura della LAB 80 film e al miglior documentario il Premio Cinemaitaliano.info con l&#39;inserimento nel circuito home video.<br /><br />Dopo il successo dello scorso anno, torna il concorso Videoclip Sessions, a cura di Freak Out Magazine, dedicato alla forma audiovisiva breve che unisce musica e immagini. La rassegna, che ha lo scopo di indagare il mondo della produzione audiovisiva nazionale e internazionale di artisti affermati ma soprattutto dei pi&#249; giovani, premier&#224; la migliore opera con il Vesuvio Award.",04/30/19 15:18:55
2733,Continuano i lavori per migliorare MyBand e l&#39;indicizzazione dei contenuti nei pi&#249; importanti motori di ricerca. Abbiamo aggiornato e migliorato la creazione della SiteMap dando precedenza alla pagina relativa alla biografia delle band iscritte. <br />Per questo motivo invitiamo i band manager ad aggiornare la biografia della propria band e sfruttare cos&#236; al massimo la visibilit&#224; di cui MyBand gode essendo il primo Social Network mai creato in Italia e dedicato alle band emergenti.<br />Infatti MyBand.it risulta essere il primo motore di ricerca musicale con il pi&#249; alto posizionamento in rete.<br />,05/06/19 19:15:52
4096,"NEBRA &#232; un progetto musicale attivo dal 2006, che propone un sound di matrice rock dalle diverse sfaccettature. Intesi come una sorta di &quot;concept band&quot;, i NEBRA si ispirano a miti, favole ed antiche leggende, attingendo in particolar modo dall’antica tradizione popolare napoletana e dai racconti tramandatici da Matilde Serao. Attraverso una rilettura dei classici in chiave moderna e mediante una scrittura che riconduce spesso a riferimenti autobiografici (rispecchiando personali stati d&#39;animo o situazioni di vita vissuta), con ricorrenti parallelismi a temi d&#39;attualit&#224;, le songs in repertorio risultano brani dalla doppia valenza interpretativa.<br />La band &#232; formata da quattro musicisti con ampia attivit&#224; musicale (live e studio) in curriculum, gi&#224; membri di bands che hanno vissuto in toto il momento storico musicale di Napoli, a partire dalla fine degli anni ’80.<br />La voce dei NEBRA &#232; affidata alla cantante (e attrice), coautrice e coarrangiatrice, AURORA PELOSI [Tragic Performance, 208 Bates Motel, Kuarantena, Nottambuli e Tammorre, Capatosta + condivisioni e collaborazioni con Massimo Jovine (JRM, Randagi, 99 Posse, Jovine, Roy Paci), Marcello Colasurdo, Mario Bancale (Targhe Alterne, Richard Benson), Marco Sfogli (NCCP, James LaBrie, PFM), Luca Comencini aka Adreenalize, Cesare “Ciccia” Minardi e Adriano “Bostik” Casale dei Contropotere, Aldo Campana e i Lega Leggera, etc.]. Ne completano la line up il chitarrista e arrangiatore GIANNI GARGIULO [White Collars/Colletti Bianchi, 208 Bates Motel, Senegal Ritmo, Capatosta + collaborazioni con svariati artisti italiani e stranieri], il bassista, coautore e coarrangiatore, nonch&#233; fondatore della band, LUCIO D&#39;ARRIGO [Donn&#39; Anna, Hell&#39;s Riders, Hell Rage + collaborazioni con diversi artisti napoletani tra cui Daniele Sepe, Marcello Coleman, Emilio Campassi, Enrico Iglio, Sergio Casamassima e Sophya Baccini dei Presence, etc.] e il batterista, coarrangiatore, ALFREDO MANZO [Linea, Soundcage, 208 Bates Motel, Kuarantena - ideatore e fondatore della ROLL Drum Sticks Factory].<br /><br />I NEBRA hanno all&#39;attivo l&#39;incisione dell&#39;album &quot;Il Disco di Nebra&quot;, prodotto e edito dalla New LM Records/Crotalo Edizioni Musicali, ℗ 2009, la partecipazione alla CD compilation &quot;Midem 2013 Free Sample CD&quot; per la New LM Records/Crotalo Edizioni Musicali, ℗ 2013, con il brano &quot;Accort&#39; &#39;a Serpe&quot;, la partecipazione alla CD compilation &quot; Neapolis Sound vol.I&quot; per Big Stone Studio, ℗ 2014, con il brano &quot;Parthenope&quot;, l’uscita del singolo ‘’Jack o’ Lantern (CHRISTO remix)”, ℗ 2017 e l&#39;incisione dell&#39;album &quot;Cuore Colpevole&quot;, prodotto e edito dalla New LM Records/Crotalo Edizioni Musicali, ℗ 2018 e distributo da IRD International Records Distribution.<br /><br />Attualmente i NEBRA sono impegnati nella promozione del nuovo album &#39;&#39;Cuore Colpevole&#39;&#39;, gi&#224; preceduto da un CD Promo contenente 4 brani, incisi con la collaborazione di LEONARDO DE LORENZO in veste di “special guest” alle percussioni, da un secondo CD Promo contenente 5 brani, incisi con la nuova line up e dal singolo ‘’Jack o’ Lantern’’ remixato da CRISTABEL CHRISTO, eclettica artista di fama mondiale, conosciuta per le sue opere pittoriche, nonch&#233; collaboratrice di illustri musicisti del calibro di Glenn Gregory (Heaven 17), Martin &#39;Youth&#39; Glover (Killing Joke), Bruce Thomas (Elvis Costello &amp; The Attractions, con cui hanno collaborato anche AURORA e GIANNI), Thomas Fehlmann (The Orb), Chaz Jankel (Ian Dury &amp; The Blockheads), John Ashton (Psychedelic Furs), John Maher (Buzzcocks), Mat Sargent (Sham69) e molti altri.<br />Parallelamente AURORA, LUCIO e ALFREDO sono stati impegnati dal 2011 al 2012, con il singer ALDO CAMPANA nel concept project provocatoriamente denominato FRATELLI D&#39;ITALIA, collettivo folk rock col quale si sono esibiti in spettacoli a tema di teatro-canzone e cui hanno preso parte, in veste di special guest, anche il violoncellista LUCIO AMANTI e il violinista PAOLO SULLO, mentre AURORA, GIANNI e ALFREDO hanno condiviso per anni la militanza nella storica rock band 208 BATES MOTEL, progetto ancora aperto, con cui hanno all’attivo incisioni, nonch&#233; un’intensa attivit&#224; live.<br /><br /><br /><br />SONGS<br /><br />Gi&#224; dal primo album, il filo conduttore dei brani &#232; il “mistero”. Ogni song racconta (in lingua italiana, inglese e napoletana) di miti, di fatti misteriosi, di favole e di leggende, molte delle quali legate alla citt&#224; di Napoli.<br />Sono quattro i temi attorno ai quali ruota questo nuovo album:<br />AMORE-INGANNO-MORTE-MAGIA<br />cos&#236; come forte &#232; il valore simbolico di ognuno dei racconti messi in musica.<br />Ci sono i racconti di streghe e dei loro rituali magici, frutto del retaggio storico del nostro territorio, come in &#39;&#39;Janare&#39;&#39; e quelli nei quali l’amore si mescola alla magia come in &#39;&#39;Vico Pensiero&#39;&#39; che focalizza il tema dell’abbandono e della memoria che si sgretola - con un pensiero speciale ai malati di Alzheimer - mediante il racconto di una delle pi&#249; antiche leggende napoletane, nel quale l’amore si mescola alla magia, ambientato in un vicolo di Napoli cancellato dal Risanamento. Troviamo l’inganno e l’astuzia dell’uomo in &#39;&#39;Accort&#39; &#39;a Serpe&#39;&#39;, &#39;&#39;Jack o’ Lantern&#39;&#39;, e &#39;&#39;Il Drago del Wawel&#39;&#39;, tutte ispirate a miti appartenenti ad altre culture e tradizioni popolari. La paura della solitudine e la rabbia sono rappresentate in &#39;&#39;The Glamis Castle&#39;s Ghost&#39;&#39;, che racconta la leggenda del vero fantasma del Macbeth di Shakespeare. &#39;&#39;Fuoco al Fuoco&#39;&#39;, invece, racconta il mito di Prometeo come simbolo di ribellione, umanit&#224; e libert&#224; ed &#232; un esplicito messaggio per sensibilizzare la gente al rispetto della propria terra e delle proprie risorse, svincolandosi da pressioni politiche e contrastando il fenomeno degli incendi boschivi e dei roghi che hanno tristemente contribuito a forgiare l’espressione “Terra dei Fuochi’’. Nella song ‘’Parthenope’’ &#232; raccontato uno dei miti sulla nascita di Napoli intesa come citt&#224; d’amore e “Friends” &#232; un omaggio alla lingua napoletana ed al suo slang sempre efficace che va evolvendosi. &#39;&#39; &#39;O Munaciello 37&#39;&#39; &#232; la figura emblematica per eccellenza, uno spirito maligno o benigno che, secondo una radicata credenza popolare, alberga nelle nostre case e troppo spesso funge da capro espiatorio per le proprie malefatte. Ogni brano &#232; sempre collegato in qualche modo a temi oscuri e misteriosi, ma anche pi&#249; leggeri e comunque di attualit&#224;, come nella title track ‘’Cuore Colpevole’’ che, attraverso il racconto dell’antica leggenda napoletana de La Barchetta Fantasma, affronta inequivocabilmente il dramma degli abusi e dei femminicidi ed &#232; una chiara condanna ad ogni tipo di violenza, psicologica o fisica, sulla donna.<br /><br /><br /><br />I NEBRA hanno all&#39;attivo la partecipazione alle seguenti rassegne musicali e mostre d’arte<br />(al titolo delle rassegne segue anno, luogo e organizzatore):<br /><br />- ROCK ARENA - 2010, Poggiomarino (NA) - Ass. PogGiovani/Comune di Poggiomarino<br /><br />- BLUE ROSE MUSIC CONTEST - 2010, Avellino - Mic.Rec./Blue Rose Caf&#232;<br /><br />- FESTA IN PIAZZA MAZZINI - 2010, Santa Maria Capua Vetere (CE) - Assessorato/Comune di S.M. Capua Vetere<br /><br />- THE DARK DAY OF THE ROCK - FESTA EUROPEA DELLA MUSICA - ROLL DAY - 2011, Sant&#39; Antonio Abate (NA) - Ass. Musicale Culturale Amadeus/Trame Africane Onlus/Comune di Sant&#39;Antonio Abate<br /><br />- NAPOLI ROCK FESTIVAL - 2014, Napoli - Laboratorio Occupato Insurgencia<br /><br />- NOTTE D&#39;ARTE - 2014, Napoli - Comune di Napoli<br /><br />- E SONO MO&#39; - XIX FESTA EUROPEA DELLA MUSICA - 2015, Napoli - Collettivo Insorgenza Musica/Assessorato alla Cultura/Comune Di Napoli<br /><br />- XIX FESTA EUROPEA DELLA MUSICA - 2015, Napoli - Big Stone Studio/Caff&#232; letterario Intra Moenia<br /><br />- ROCK SUL MARE - Notte bianca: music and street art - 2015, Marina di Vietri (SA) - Ass. musicale Echoes/Forum dei Giovani/Comune di Vietri sul Mare/Assessorato alle politiche giovanili e allo sport<br /><br />- NOTTE D&#39;ARTE - 2015, Napoli - Comune di Napoli<br /><br />- PSYCO PUNK ROCK PARTY Benefit Le 3G del Tien&#39;a&#39;Ment - 2016, Napoli - Scugnizzo Liberato/Tien&#39;A&#39;Ment<br /><br />- LE 3 GIORNATE DEL TIEN&#39;A&#39;MENT - L3G Musik Fest - 2016, Napoli - Scugnizzo Liberato/Tien&#39;A&#39;Ment<br /><br />- FESTA DELLA RISCOSSA POPOLARE - 2016 Parco dei Camaldoli, Napoli<br /><br />- ROCK THE ZOMBIE 2016/2017 - 2017, Napoli - Rock The Zombie<br /><br />- INTERNATIONAL TATTOO FEST NAPOLI Contest Semifinale - 2017, Napoli - M.V.O.<br /><br />- SUN ROCK FESTIVAL 2017 - 2017, Napoli - Rock The Zombie<br /><br />- WOODY GROOVE FESTIVAL 2017 - 2017, Napoli - Woody Groove<br /><br />- NERANO MUSIC FESTIVAL - 2017, Nerano (NA) - Consorzio AmoNerano<br /><br />- WOODY GROOVE FESTIVAL 2017 - 2017, Potenza - Woody Groove<br /><br />- TOMBOLATI di BARBARA KARWOWSKA - 2018, Galleria d’Arte Salvatore Serio, Napoli<br /><br />- CASTLE FONDI MUSIC FESTIVAL - 2018, Fondi, (LT)<br /><br />- IMPATTO ROCK UNDERGROUND METAL FEST - 2018, Napoli -<br />Impatto Rock<br /><br />- IL GRANDE VENTO 2018 - 2018, Napoli - Ex Asilo Filangieri<br /><br />- CUORI SENZA FRONTIERA - 2019, Villaricca (NA)<br /><br />- PIANETI IMMAGINARI di SERGIO WILLIAMS - 2019, Galleria d’Arte We Space, Napoli<br /><br /><br /><br />Nel corso di alcuni contest a cui hanno preso parte, sono risultati:<br /><br />- SEMIFINALISTI al concorso nazionale &quot;Rock sul Mare 2015&quot;.<br /><br />- SEMIFINALISTI al concorso regionale &#39;&#39;International Tattoo Fest Napoli - Contest 2017&#39;&#39;.<br /><br />- SEMIFINALISTI al concorso regionale &#39;&#39;Campania Eco Festival - Differenzia Rock Contest 2017&quot;.<br /><br />- FINALISTI al concorso nazionale &#39;&#39;Contest Classic Rock Italia 2017&quot;.<br /><br />- FINALISTI al concorso nazionale &#39;&#39;Woody Groove 2017.<br /><br /><br /><br />DISCOGRAFIA<br /><br />NEBRA &quot;Il Disco di Nebra&quot; - CD, 2009 - New LM Records/Crotalo Edizioni Musicali<br />NEBRA &quot;PROMO&quot; - CD, 2010<br />NEBRA in &quot;Midem 2013 Free Sample CD&quot; - CD Compilation, New LM Records/Crotalo Edizioni Musicali, 2013<br />NEBRA in &quot;Neapolis Sound vol.I&quot; - CD Compilation, Big Stone Studio, 2014<br />NEBRA &quot;PROMO&quot; - CD, 2016<br />NEBRA “ JACK O’ LANTERN (CHRISTO remix)”, single, 2017<br />NEBRA &quot;Cuore Colpevole&quot; - CD, 2018 - New LM Records/Crotalo Edizioni Musicali - IRD International Records Distribution<br /><br /><br /><br /><br />web pages &amp; sites:<br />Facebook https://www.facebook.com/NEBRAfanpage<br /><br />YouTube http://www.youtube.com/user/NEBRAbandnapoli<br />http://www.youtube.com/user/apewasp<br /><br />SoundCloud https://soundcloud.com/nebra-napoli<br /><br />ReverbNation http://www.reverbnation.com/aurorapelosi<br /><br />MySpace https://myspace.com/nebranapoli<br /><br />Spotify https://open.spotify.com/album/4vqKREyd7Rqo001fCNeGLg<br /><br />",05/07/19 12:22:17
4131,https://www.youtube.com/watch?v=FCut8LBVdeY,06/22/19 14:29:31
331,https://www.rockrevolution.it/news/trinacria-rock-contest-2019/,07/09/19 22:59:12
4136,"ciao Giuseppe, benvenuto su MyBand.it",07/10/19 06:10:04
2733,"&#200; incredibile, abbiamo decine di nuovi video da mandare in onda! <br />Soltanto ieri abbiamo lanciato la notizia che a Settembre saremmo ripartiti con la trasmissione #MyBandTv collegata a questo portale ed in onda su #Televomero e nel giro di poche ore abbiamo ricevuto decine di nuovi video da mandare in onda. Grazie a tutti!",08/02/19 19:42:31
3463,vuole entrare nelle vostre orecchie e rimanerci!,01/14/11 16:34:55
3463,La nostra pagina My-Band è ora completa! :D,01/14/11 20:11:43
