legacy_gestore_id,testo,data
3758,"Adesso i SOUND THEORY si stanno preparando per un importantissimo concorso :D... e a divulgare la canzone ""Lost Reason""!",06/05/13 15:08:05
3758,http://www.youtube.com/watch?v=k36SQJqDt7A Questo è il link di LOST REASON!!!!!!!,06/05/13 15:11:23
3759,"'While everyone's lost the battle is won, with all these things that I've done..'",06/05/13 17:01:52
3759,Ascoltatela se vi va... http://www.youtube.com/watch?v=feYyYJy2BAU,06/05/13 17:22:01
2948,si mena il cucco,06/05/13 22:28:29
3572,Ho caricato il nostro videoclip!Vai subito nella sezione Video per vederlo!,06/08/13 17:34:19
3761,Al lavoro sul nuovo singolo in uscita questo autunno!,06/10/13 16:15:10
3762,appena iscritto su MyBand,06/10/13 19:15:47
3675,"Lavoro in studio terminato, adesso la cover del disco.... un contest è in arrivo.",06/11/13 11:44:25
3675,"Lavoro in studio terminato, adesso la cover del disco.... un contest è in arrivo.",06/11/13 11:44:25
3765,Work in progress :-),06/11/13 16:49:48
3765,Work in progress,06/11/13 16:50:06
3766,Stiamo lavorando al nuovo disco. Stay Tuned,06/14/13 15:40:17
3767,workin projecting and playing,06/17/13 15:53:03
3768,work in progress,06/18/13 16:44:01
3769,\m/,06/18/13 17:51:33
3759,Si avvicinano le registrazioni,06/19/13 18:42:52
3770,Stiamo registrando!,06/20/13 09:10:31
3771,In studio a registrare nuovi brani,06/20/13 17:15:47
3767,recording =),06/21/13 15:41:31
3772,"Dopo il nostro debutto live ad un contest qui in Campania, stiamo perfezionando i nuovi brani, in attesa di poter registrare e pubblicare un EP!",06/21/13 17:59:10
3773,meditazione pre-prove,06/24/13 12:24:03
3774,"E pens pure a chill uocchije tuoje scure ormai cunsumat pecchè hanno chiagniut, perdenn a uno 're figlije ca parte appriesso a ati mille ca se ne so gghiute.",06/25/13 15:55:43
3774,"Allora credo non sia sufficiente restare e provarlo a cambiare, questo paese del cazzo che non da più spazio alla creatività!",06/26/13 01:30:53
3774,"E’ cos ‘e nient je me ne vaco p’a strada mij, ieni cummè te port int’ o vicolo ‘e l’alleria,tant cchiù nnera ‘ra mezzanotte nun po’ venì...",06/26/13 21:37:02
3774,"Lei ballava e saltava al ritmo ossessivo suonato dal fuoco e dal vento, ed il tempo, mentre t’aspetto mi sembra si fermi ed il giorno sia sempre più lento...",06/27/13 10:51:16
3780,Pubblicazione EP,06/27/13 11:15:21
3774,Fujetenne… fujetenne… Ma nun serve a niente... Pecchè l’ombra nera ca te puort ‘aret te ten pe pier...,06/27/13 17:01:32
3783,[USEALAND] Tour 2013,06/28/13 12:06:20
3774,A volte il problema vero degli italiani è guardarsi allo specchio e sentirsi stranieri.,06/28/13 18:21:51
3774,Si sa l’aria è pesant… e nun ce stà pacienza...  P’a smania e avé coccos tutt quant vann ‘e pressa...,06/29/13 14:39:27
3774,"Martedì 2 Luglio vi aspettiamo al ReTrain Music Contest, #Pomigliano, #Napoli!!!",06/29/13 15:35:23
3774,Finalmente AMARCORD live all'Agorà Jazz Festival - http://youtu.be/fBDDUs0h_OQ #lamaschera #amarcord #napoli,06/30/13 15:34:48
3788,Stiamo Fremendo per nuovi live show! Non vediamo l'ora di suonare dal vivo!,07/03/13 01:03:02
3774,"Restai li ad aspettare un suo gesto, un qualcosa che desse alla vita un sapore diverso, anche un semplice sguardo… ma lei..",07/03/13 15:17:36
3767,"DistintO Recensione ""In Genere"" http://www.shiverwebzine.com/2013/07/04/distinto-in-genere-2013-autoprodotto/",07/04/13 12:30:05
3774,ReTrain Music Contest: Siamo in finale Domenica 14 Luglio a Pomigliano!!!! Intanto... Fujetenne https://soundcloud.com/la-maschera/fujetenne,07/05/13 04:41:00
3767,"DistintO Recensione ""In Genere"" http://www.shiverwebzine.com/2013/07/04/distinto-in-genere-2013-autoprodotto/",07/06/13 18:20:41
3774,"Penzav e saje quanti vot penzav che na chitarra cagnava coccos', fin quand ajere po' m'aggio scetat a chilli suonn 'arò t'aizze surato..",07/07/13 16:01:04
3780,Il nostro Ep è online!!,07/07/13 16:26:53
3791,Appena iscritti,07/07/13 17:28:05
315,"semifinalisti al premio Poggio Bustone e al tour music fest.....a breve altre date vi terremo aggiornati, seguiteci su FACEBOOK",07/08/13 00:30:14
3793,salve ragazzi,07/09/13 10:11:29
3767,DistintO next live 11/7 Spazio Corelli (MI) //// 13/7 Bellusco (MB),07/09/13 17:45:08
3720,VENERDI NOTTE BIANCA PALINURO CON I THE HORNET'S,07/10/13 09:27:55
3767,DistintO tonight live @ Spazio Corelli h.22 free entry =),07/11/13 15:25:06
3794,Si prepara al meglio per il concerto per la festa di Sant'Anna il 26 luglio a via lieti,07/12/13 16:52:45
3767,"Sabato 13/7 DistintO live @ Bellusco per ""Bellusco e Dintorni D' Autore"" piazza Kennedy, Bellusco (MB) START H. 20 DISTINTO LIVE H. 21.30",07/12/13 17:12:50
3774,Domenica La Maschera Live A Pomigliano per il ReTrain Music Contest! [http://www.youtube.com/watch?v=0Uu897XsZ7A],07/12/13 17:20:41
3796,"La band, dopo la pubblicazione delle versioni deluxe di ""Awake From The Game"" e ""Remix From The Game"", sta aspettando di annunciare la partecipazione ai festiva",07/15/13 11:45:08
3774,"Venerdì 19/07 Beltrami @ CocoLoco, Frattamaggiore (Na) Start ore 22.00 Open Act: La Maschera! https://www.facebook.com/events/216658131816162/?ref=22",07/15/13 14:40:22
3798,Stand By,07/15/13 22:53:45
3797,Ora ci stiamo preparando al meglio per suonare live e spaccare tutto!!,07/20/13 13:20:10
3774,"Quante belle notizie!! Il nostro video ""La Maschera - Il Ballo Del Potere"" in primo piano per tutto il mese di Agosto!! GRAZIE!!",07/23/13 15:10:26
3767,DistintO Domani dalle 16 in radio per Musicon TheRadio fm 96.1 per una breve intervista ed un unplugged.. senza aggeggi elettronici,07/23/13 15:22:25
3774,Pullecenella è stanco è nun ‘o dice!,07/26/13 00:24:40
3774,Stiamo per registrare il video di Pullecenella a Napoli! Ci serviranno moltissime comparse. A breve sulla pagina FB l'evento per comparse!,07/28/13 14:13:59
3774,Vuoi partecipare al videoclip di Pullecenella? Qui troverai tutte le info --> https://www.facebook.com/events/609483155750529/?ref=22,07/28/13 16:45:20
3774,"La Maschera cerca compare per videoclip singolo venerdì 2 agosto ore 17 piazza carità, napoli e Sabato 10 agosto suoneremo all'Hera Wine Bar di Pozzuoli",07/29/13 17:22:29
3774,"Ragazzi, serve 'a voce vostra! Venerdì 02 Agosto - ‪#‎PiazzaCarità‬ (NA) - ORE 17:00 [https://www.youtube.com/watch?feature=player_embedded&v=fRQ05N9gOS4]",07/30/13 13:17:14
3774,"Grazie a tutti da parte de La Maschera, vi ricordo che stiamo aggiornando il profilo costantemente quindi fatevi un giro nel blog/galleria foto/sezione eventi!",08/03/13 03:11:35
3767,"DistintO recensione ""In Genere"" dagli amici di Rockambula http://www.rockambula.com/distinto-in-genere/",08/04/13 17:19:36
3803,in preparazione nuovi live...,08/05/13 09:45:13
3774,"La Maschera Live all'Hera Wine Bar di Pozzuoli 10/08, Metrò Gold di Mugnano 9/08 (con presentazione videoclip ""Pullecenella"") e CocoLoco Jam Anticamorra 8/08!!",08/06/13 14:08:23
3796,composing new album,08/07/13 13:51:06
3804,Compone e registra nuovi pezzi e prepara live.,08/12/13 15:24:39
3788,Nuove registrazioni d'agosto.,08/13/13 05:15:02
3805,"Giornata svago terminata, da domani si torna a scrivere ;)",08/16/13 02:10:53
3675,Rage of South - 27/09/2013 rilascio dell'album. http://www.youtube.com/watch?v=C00OJaDdAH0,08/19/13 19:53:37
3806,In fase di scrittura brani!,08/20/13 03:46:36
3774,"""La Maschera"" sta preparando tante belle cose per Settembre... intanto visitate la nostra pagina, appena aggiornata!",08/20/13 06:54:29
3791,Siamo passati alla #finale del #music #contest TALENTI D'ESTATE Il prossimo appuntamento è per il 29 Luglio presso il Gran Shopping Mongolfiera di #Molfetta,08/22/13 23:38:10
3791,Selezionati per le finali di Puglia Talent  :) appuntamento 25 Agosto ore 20:30 in piazza Vittorio Emanuele a Monopoli,08/24/13 22:03:56
3678,Questa sera festa della birra a Racalmuto!!!!,08/28/13 10:42:04
2382,chi fa per se fa per TRE!!!,08/28/13 10:56:33
1570,Il 4 febbraio 2013 esce il nuovo singolo dal titolo “La Ballata Dei Panni Sporchi” rimanendo per oltre 3 mesi nella classifica radio della Indie Music Like.,08/28/13 13:42:52
1570,"L'8 Aprile 2013 esce il nuovo album ""Come Pietre"", prodotto da GCM Factory e distribuito da ALKA record label",08/28/13 13:56:21
2535,Si suona!,08/28/13 17:01:57
3139,Stiamo per pubblicare il nostro 1° Album.....Datevi tempo! In uscita a Ottobre...non vediamo l'ora...e si lavora gia' al secondo,08/29/13 18:26:09
3751,I Grocers vincono anche il Be Contest di Marghera!!,09/06/13 16:25:54
3767,DistintO next live: 14-9 Susa // 21-9 Brescia // 28-9 Saronno =),09/07/13 15:27:34
3767,DistintO : intervista per Shiverwebzine =) http://www.shiverwebzine.com/2013/09/09/perfetti-ma-non-troppo-intervista-ai-distinto/,09/10/13 11:35:21
3808,In preparazione per Milano,09/12/13 13:28:16
3774,"Domani La Mascherà sarà a Soccavo, Napoli nella Villa Autogestita Don Gallo!",09/15/13 04:54:41
3809,è uscito il Video ufficiale di Riot! http://www.youtube.com/watch?v=0S42NUPwLRU,09/15/13 14:54:38
3810,...work in progress...,09/16/13 12:07:45
3774,Sabato 21 Settembre La Maschera Live @ Kestè,09/17/13 17:59:54
3720,@THEHORNETS,09/18/13 12:03:01
3791,"Olga & The GangBand @ Victorian Pub Monopoli , Domenica 22 Settembre 2013 ore 20:00 , selezioni Puglia Talent 2014",09/19/13 02:10:02
4078,"ciao Gianluca, stiamo testando la TIMELINE!!!",09/19/13 08:27:27
4078,ciaoooooooooooooo Gianluca!!!,09/19/13 08:52:58
4078,facciamo un'altra prova!,09/19/13 08:58:26
2651,ciao BandDemo!!!,09/19/13 10:28:04
3791,"Ciao ragazzi, possiamo provare con qualche botta e risposta la nuova timeline? Come vanno le cose? State suonando? A presto, lo staff!",09/19/13 16:58:37
3536,"Ciao ragazzi, benvenuti su myband.it. Ci parlte della vostra iniziativa? A presto, lo staff",09/19/13 16:59:54
3767,"Ciao ragazzi, ci aiutate a testare la nuova timeline con qualche botta e risposta? Come vanno le cose? State suonando? A presto, lo staff di MYBAND.IT",09/19/13 17:01:30
3748,"Ciao ragazzi, ci aiutate a testare la nuova timeline con qualche botta e risposta? Come vanno le cose? State suonando? A presto, lo staff di MYBAND.IT",09/19/13 17:01:56
3754,"Ciao ragazzi, ci aiutate a testare la nuova timeline con qualche botta e risposta? Come vanno le cose? State suonando? A presto, lo staff di MYBAND.IT",09/19/13 17:03:58
2651,sono vivo e sono qui!,09/19/13 17:11:56
3791,Domenica 22 Settembre suoneremo al Victorian Pub di Monopoli.,09/19/13 18:54:57
3791,"Venerdì 20 settembre, ore 20.00, ospiti di ""VIDEOMIX - Una finestra aperta sui talenti della Puglia"", OLGA & THE GANGBAND!
Seguiteci sul CANALE 96 del digitale terrestre oppure in STREAMING sul sito www.videoitaliapuglia.it",09/19/13 18:55:13
3228,"Ciao ragazzi, siete ancora attivi?",09/19/13 20:55:01
4078,"Nuovo test, ciao!",09/19/13 20:56:14
82,ciao ROCKGAME!!!,09/21/13 10:30:38
3767,"DistintO vince il Festival Verso L Altro di Brescia categoria inediti con il brano ""MI HAI"" =)",09/23/13 13:15:25
3815,"ramones, clash, rancid, nofx",09/26/13 17:17:09
3815,tra poco si va in sala prove... yesss,09/26/13 17:17:31
3816,Eccoci su Myband!,09/26/13 23:31:43
3816,Seguiteci anche su What if? The official website!,09/26/13 23:32:08
3816,Stiamo lavorando al nostro primo album!,09/26/13 23:32:25
3817,Nuova Band emergente lombarda.,09/27/13 02:16:34
3767,DistintO live 28/9 Saronno h 18/24 =),09/27/13 11:46:11
3816,"Seguiteci anche su facebook! 
https://www.facebook.com/WhatIfgruppomusicale",09/27/13 13:22:20
3816,"Unitevi al nostro fans club ufficiale di facebook!
https://www.facebook.com/groups/306142176151307/",09/27/13 13:22:46
3774,"ciao ragazzi, state suonando??? teneteci aggiornati!!!",09/28/13 11:35:11
2867,"Ciao ragazzi, myband.it si è aggiornato, venite ad aggiornare la vostra TimeLine!",09/29/13 18:04:24
3768,"Soddisfattissimi per l'ultimo singolo dal titolo menomale, è boooom di ascolti su youtube, ecco il videoclip. http://www.youtube.com/watch?v=cg3yMrw-WII",09/30/13 09:02:58
4078,Ciao Gianluca! Grazie per il follow!,09/30/13 10:44:50
3819,accordiamo gli strumenti in vista della grande esibizione di domani,10/03/13 01:22:18
3819,"esibizione solo a metà a causa di forza maggiore, ringraziamo con affetto tutti i nostri fun che sempre ci seguono e l'associazione diversarte per averci fatto esibire in una manifestazione così importante, ora siamo in cerca del nostro prossimo live... (A^2)",10/07/13 19:16:05
3821,"caricate il vostro logo, grazie!",10/08/13 11:00:03
3166,"caricate il vostro logo, grazie!",10/08/13 11:01:28
3644,"caricate il vostro logo, grazie!",10/08/13 11:01:31
3184,"caricate il vostro logo, grazie!",10/08/13 11:01:34
2993,"caricate il vostro logo, grazie!",10/08/13 11:01:38
2733,"caricate il vostro logo, grazie!",10/08/13 11:01:41
3253,"caricate il vostro logo, grazie!",10/08/13 11:01:44
3486,"caricate il vostro logo, grazie!",10/08/13 11:01:48
3252,"caricate il vostro logo, grazie!",10/08/13 11:01:52
3125,"caricate il vostro logo, grazie!",10/08/13 11:01:55
3498,"caricate il vostro logo, grazie!",10/08/13 11:01:58
3133,"caricate il vostro logo, grazie!",10/08/13 11:02:02
2757,"caricate il vostro logo, grazie!",10/08/13 11:02:04
3578,"caricate il vostro logo, grazie!",10/08/13 11:02:07
3815,"caricate il vostro logo, grazie!",10/08/13 11:03:33
3808,"caricate il vostro logo, grazie!",10/08/13 11:03:37
3678,"caricate il vostro logo, grazie!",10/08/13 11:03:39
3806,"caricate il vostro logo, grazie!",10/08/13 11:03:42
3805,"caricate il vostro logo, grazie!",10/08/13 11:03:45
3797,"caricate il vostro logo, grazie!",10/08/13 11:03:48
3794,"caricate il vostro logo, grazie!",10/08/13 11:03:51
3793,"caricate il vostro logo, grazie!",10/08/13 11:03:53
3792,"caricate il vostro logo, grazie!",10/08/13 11:03:56
3783,"caricate il vostro logo, grazie!",10/08/13 11:03:59
3782,"caricate il vostro logo, grazie!",10/08/13 11:04:01
3769,"caricate il vostro logo, grazie!",10/08/13 11:04:30
3766,"caricate il vostro logo, grazie!",10/08/13 11:04:34
3765,"caricate il vostro logo, grazie!",10/08/13 11:06:07
3761,"caricate il vostro logo, grazie!",10/08/13 11:06:10
3758,"caricate il vostro logo, grazie!",10/08/13 11:06:16
3757,"caricate il vostro logo, grazie!",10/08/13 11:06:22
3749,"caricate il vostro logo, grazie!",10/08/13 11:06:25
3745,"caricate il vostro logo, grazie!",10/08/13 11:06:27
3744,"caricate il vostro logo, grazie!",10/08/13 11:06:30
3738,"caricate il vostro logo, grazie!",10/08/13 11:06:33
3724,"caricate il vostro logo, grazie!",10/08/13 11:06:36
3720,"caricate il vostro logo, grazie!",10/08/13 11:06:39
3718,"caricate il vostro logo, grazie!",10/08/13 11:06:42
315,"caricate il vostro logo, grazie!",10/08/13 11:06:45
3704,"caricate il vostro logo, grazie!",10/08/13 11:06:48
3702,"caricate il vostro logo, grazie!",10/08/13 11:06:51
3699,"caricate il vostro logo, grazie!",10/08/13 11:06:54
3758,La band SOUND THEORY,10/09/13 12:39:57
3758,La band SOUND THEORY sta partecipando ad un concorso (Tour Music Fest) importantissimo dove premio ci sarà un contratto di distribuzione con la casa discografica Universal Music et un tuor in Europa. Si impegna molto per queste fasi suonando e quindi provando con tenacia!!! Si spera che tutto vada per il meglio d:D!,10/09/13 12:42:59
3765,dai un mi piace a noi www.facebook.com/thedarkshinesband,10/15/13 09:44:53
3731,"Vogliamo segnalarvi la promozione low cost IRON WEB PACKAGE che il press bureau internazionale DVLGATOR ha lanciato da poco! 
Potrete darvi un'idea dell'esposizione che vi offrirà questo pacchetto visitando il nostro blog italiano cliccando il link sottostante!
Sono garantiti risultati straordinari, pubblicazione del comunicato stampa, di immagini, link ai video ed al vostro sito, il tutto in 30 siti compresi blog e community musicali ad alta indicizzazione sui motori di ricerca!
Per vedere un esempio di report dettagliato (in PDF), come quello che andrete a ricevere anche voi, cliccate qui: 
http://dvlgatoritalia.blogspot.it/p/offerta-promozione.html 
Attraverso una via preferenziale i comunicati saranno inviati e sottoposti all'attenzione di alcune delle più prestigiose etichette discografiche, nostre partners!
sperando di avervi inviato una news gradita, un saluto!",10/23/13 11:38:11
3767,Sabato 28/12 DistintO live @ Il Paniere (CR),12/27/13 15:05:27
3833,"Esci dal nido con AREZZO WAVE BAND 2014 e vola ad afferrare le tante opportunità che mette in palio il contest più partecipato d'Italia!!

Iscriviti entro il 15 gennaio, è gratis!!

Oltre 100 date di selezione live in tutta Italia, un premio in denaro di 1000€, la possibilità di suonare all'estero su palchi prestigiosi e tanto altro ancora!

Ricorda hai tempo fino al 15 gennaio!

http://www.arezzowave.com/italia-wave-band/iscrizione-concorso-2014",01/09/14 12:48:11
3837,Ascoltate e scaricate gratuitamente le nostre produzioni sul nostro soundcloud! www.soundcloud.com/triptracks,01/16/14 16:50:48
3599,"The first album of THC!!

BANDCAMP     http://thc5.bandcamp.com/album/amigdala",01/21/14 13:54:34
3248,http://www.youtube.com/watch?v=C1zH85-c5ZU,01/21/14 14:28:42
3844,"http://www.youtube.com/watch?v=iRi2T82bs-Q

Preview waiting for the heroes",01/21/14 22:17:44
3844,"http://www.youtube.com/watch?v=iRi2T82bs-Q

Preview waiting for the heroes",01/21/14 22:17:47
3844,"http://www.youtube.com/watch?v=iRi2T82bs-Q

Preview waiting for the heroes",01/21/14 22:17:49
3545,IL VERSO DELL'UOMO,01/23/14 08:14:07
3849,"Formazione completata! Diamo il ben venuto al nuovo chitarrista Marcello Zampi e alla seconda voce Nicholas Pierangelini! Musicians at Work, per voi, per portare nuove idee e nuova concezione di musica in territorio romano e italiano! A breve con nuove news!

Stay core! _\m/",03/08/14 15:28:27
3849,"Formazione completata! Diamo il ben venuto al nuovo chitarrista Marcello Zampi e alla seconda voce Nicholas Pierangelini! Musicians at Work, per voi, per portare nuove idee e nuova concezione di musica in territorio romano e italiano! A breve con nuove news!

Stay core! _\m/",03/08/14 15:28:29
3850,"A.N.P.I. sez. Egidio Dedè di Ronco Scrivia (GE), con la collaborazione de La Quinta del Lupo, organizza “TOUTE LA MUSIQUE QUE J’AIME”, concorso musicale finalizzato all’esibizione live dei primi 5 classificati sul palco di Spazio Libero Resistente, a Ronco Scrivia (GE) il 21 giugno 2014.
Il premio per la band vincitrice del concorso è la produzione di un singolo con registrazione in studio professionale, una prima tiratura di 20 cd e la realizzazione di un videoclip.
Alle band partecipanti è richiesto l’invio, entro il 10 maggio 2014, di un pezzo originale in formato mp3 e di un video amatoriale che sarà pubblicato su Facebook e votato dal pubblico! Tutte le info su www.spazioliberoresistente.com",03/27/14 16:14:50
3850,www.spazioliberoresistente.com,03/27/14 16:18:23
3854,Rec :),04/12/14 14:54:38
3854,Rec :),04/12/14 14:55:03
3767,"Nuovo video per Distinto:
Il mondo non aspetta

https://www.youtube.com/watch?v=KdnSe-JRJzs",06/29/14 14:20:35
3861,Dal 19 giugno al 15 settembre 2014 carica i tuoi brani su www.redbulltourbus.it e crea il tuo profilo,07/09/14 12:49:01
3863,ciao a tutti,08/04/14 20:01:56
3731,"Vi presentiamo un nuovo locale musicale!!
Il Civico8 ed il suo staff hanno riportato nel piovese un locale di tendenza. Tutti i weekend il locale si trasforma in un vero e proprio polo d'attrazione grazie ai DJ's resident dell'allTypeOne ed alla collaborazione con molti artisti di fama nazionale ed internazionale.

Ampio lo spazio esterno estivo situato nella piazzetta dove si possono degustare sfiziosi snack, un ricco aperitivo,  drink speciali e buona musica d'intrattenimento.

Prenotazioni per: Feste di Compleanno,  Laurea,  Aziendali,  Associazioni, etc...

Civico 8 - Piazzetta Carlo Rossi, 8 - Piove di Sacco (PD)

http://civico8.nlz.it
https://www.facebook.com/civico8p",08/05/14 12:53:57
3731,"Abbiamo il piacere di annunciare che la DeFox Records si prepara per le nuove uscite previste per Settembre e Ottobre, una ""vagonata"" di Rock e Metal!! Attivissima con le sue labels, in questo caso con HEART OF STEEL RECORDS, continua nell'attività di promozione dei migliori talenti dell'underground mondiale, lanciando sul mercato bands validissime ed interessanti!! Aspettiamoci il debut album dei rockers brasiliani TINY SETBACK, il debutto tutto metal anni 80 dei polacchi LIVIN FIRE che hanno una bravissima frontgirl! Attesa anche per gli spagnoli UNHUMAN NATURE, una sorta di super band dedita ad un metal prog con venature power! Altre novità da oltre oceano, dal Brasile, con band di True Metal agguerrite e pronte ad invadere l'europa, arriverà il terzo ep di ETERNAL FATE e gli albums di SYMPTOMEN!! stay tuned!! http://defoxrecords.blogspot.com",08/23/14 14:14:47
3239,LA BAND SUONA BRANI INEDITI GENERE AUTORE/ROCK ALTERNATIVO. I TESTI SONO IN LINGUA ITALIANA,08/23/14 14:23:45
3239,"STIAMO LAVORANDO AD UN NUOVO PROGETTO IN STUDIO CONTENENTE 8 BRANI INEDITI. IL TITOLO DEL PROGETTO SARA': ""CUSTODI DI NUOVI MONDI"" I TESTI SONO UN MIX TRA EPISODI FANNO PARTE DELLA VITA REALE E PERSONAGGI O COSE IMMAGINARIE PROVENIENTI DA VISSUTI ONIRICI, STATI DI TRANS, FANTASIE. LE ATMOSFERE DELLE MUSICHE SONO LIVE E FIABESCHE. AUSPICHIAMO NEL RITORNO DELLA CULTURA DEGLI AUTORI ITALIANI NON COSTRUITI DA STRATEGIE COMMERCIALI",08/23/14 14:31:57
3870,Visita il sito di Andrea Astarita https://andreaastarita.wix.com/andrea-astarita,09/28/14 22:38:32
3875,Per chi volesse ascoltare o scaricare i nostri brani questa è la pagina: http://www.reverbnation.com/futharkmedieval?profile_view_source=header_icon_nav,11/11/14 12:23:39
2917,stand-by?,11/28/14 09:29:23
3878,"Finalmente il nostro primo ep è pronto per l'ascolto!
Clicca sul link qui sotto e partirà!
Speriamo vi piaccia!


https://soundcloud.com/bless-24/sets/forever-and-a-day",12/02/14 13:45:04
3873,"...e allora...si balla con i propri demoni!!

https://www.youtube.com/watch?v=v3r6kqfckFA",01/19/15 21:07:56
3887,"Dopo la presentazione del primo album: The Dinasyt, la band ha cominciato la pre produzione del secondo! E andiamo!!!
IGDG",01/20/15 11:20:31
3873,"Continua il pre-order per il nuovo album della mia band Secret Rule, sostenere la musica originale, soprattutto per chi è amante del rock, è un dovere!! ...quindi ascoltatevi qualcosa online sulla pagina ufficiale e guardatevi i video, se vi piace, allora ordinate il fantastico FAN-PACK comprensivo di CD & T-Shirt (di alta qualità ) a questo indirizzo, vi arriverà direttamente a casa! CONTO SU TUTTI VOI! Grazie! E buona musica! 

http://www.mwaweb.com/rocksectorbands_secretrule.htm

https://www.youtube.com/watch?v=cTPpwz6g7IM&feature=youtu.be",01/27/15 12:36:11
3873,Ed ecco il nostro terzo singolo 'I Don't Wanna Be'!!! E se vi piace...condividetelo!https://www.youtube.com/watch?v=1EOCxtjUE80,02/06/15 14:48:52
3893,I Punkakes il 7 marzo faranno da spalla alla band musicale Punkreas al Videa di Cesena,02/27/15 20:58:40
3731,"La nostra società è alla ricerca di nuovi talenti da lanciare sul mercato discografico
Ogni genere musicale è ben accetto!Visitate il nostro sito per farvi un idea riguardo la nostra attività.
Potete sottoporre le vostre canzoni, album e materiale promozionale, noi valuteremo con attenzione e vi daremo sicura risposta!

Spedite a : music@nerocromo.com 
Nerocromo Music : http://music.nerocromo.com",03/13/15 12:20:47
3759,"ciao ragazzi... benvenuti su MY-BAND.IT. Abbiamo visto il video, molto bello!!!",03/20/15 13:38:27
3898,E da oggi si inizia col Mixaggio album!!!!!!,04/07/15 11:28:20
3900,"Ecco il link per ascoltare Concept, il primo EP dei Sunday Socks:
https://soundcloud.com/sundaysocksband/sets/concept-ep",04/15/15 14:53:40
3857,"MusicAle 2015 XI Edizione. Concorso per artisti emergenti.
Due categorie: "" Gruppi "" e "" Singoli""
Primo premio per entrambe le categorie produzione e distribuzione di un singolo.
Bando e informazioni su www.ilmusicale.it info@ilmusicale.it
Con il Patrocinio di Provincia di Pisa, Regione Toscana.",05/03/15 22:24:24
3873,"I Secret Rule rilasciano il 4° videoclip 'Reena' e si preparano per il nuovo tour che li vedrà in Francia e UK con una serie di date in Luglio.

https://www.youtube.com/watch?v=cIDLHmFnolU&feature=youtu.be

Vi aspettiamo sulla nostra pagina ufficiale www.facebook.com/secretrule",07/05/15 15:50:36
3910,La band è di nuovo in sala per i prossimi eventi. Seguiteci.,10/06/15 17:14:50
3794,"MSG x Carlo e Yuri: vi aspetto al NAIS, Via Ferrigni (zona baretti chiaia, chiattilla per intenderci!) per una vostra ospitata. Mi fa davvero piacere se venite. 
la mia mail gianlucadipietro@gmail.com",10/13/15 09:05:00
3917,Good news for you!!!! coming soon we'll publish some good and big news so stay tuned!!,02/17/16 22:38:29
3917,"Hi all!!!! We are void prophet we are a progressive/melodic death metal band from Verona (it), our main influences are Destrage, Periphery, Protest The Hero, The Haarp Machine, Death, Persefone, Arch Enemy...
live dates in northern Italy coming soon! Follow us for more news and updates!!!",02/17/16 22:41:26
3917,"Hi all!!!! We are void prophet we are a progressive/melodic death metal band from Verona (it), our main influences are Destrage, Periphery, Protest The Hero, The Haarp Machine, Death, Persefone, Arch Enemy...
live dates in northern Italy coming soon! Follow us for more news and updates!!!",02/17/16 22:41:28
3917,"Ok people, for all infos about the band you can scroll down in this page, you will find 3 links to some live videos, the bio of the band and some photos of the members (taken during one of the last gig), you can follow us also on Facebook where you'll rinf all informations you need and all updates from the guys and all news about new dates! link: https://www.facebook.com/voidprophetmetal/ 
Like, Support and share the page to help us growing, and obviously listen to us and come to our concerts!!!",02/17/16 23:01:41
